[
  {
    "id": "eq-petit-pays-choix-oeuvre",
    "oeuvre": "Petit pays",
    "auteur": "Gaël Faye",
    "question": "Pourquoi avez-vous choisi de présenter Petit pays pour cet entretien ?",
    "category": "choix-oeuvre",
    "pistes": [
      "Justifier par la force du contraste : Faye installe d'abord une enfance heureuse (l'impasse, la bande d'amis, les jeux) pour mieux faire ressentir sa destruction par la guerre.",
      "Mettre en avant l'intérêt historique : le roman fait comprendre de l'intérieur la guerre civile burundaise et le génocide des Tutsi au Rwanda en 1994, vus à hauteur d'enfant.",
      "Souligner une raison personnelle : avoir découvert par un récit une page d'Histoire qu'on ne connaissait que de loin, et avoir été touché par la question du métissage de Gaby.",
      "Mentionner la dimension de lecture cursive et la beauté de l'écriture, héritée du parcours de musicien et de parolier de l'auteur."
    ],
    "reponseEssentielle": "J'ai choisi *Petit pays* de Gaël Faye (2016) pour la **force du contraste** : il installe d'abord une enfance heureuse, l'impasse et la bande d'amis, pour mieux la faire détruire par la guerre. Le roman m'a fait comprendre de l'intérieur la guerre au Burundi et le **génocide des Tutsi au Rwanda en 1994**, vus par un enfant. J'ai aussi été touché par la question du **métissage** de Gaby.",
    "difficulty": 1,
    "order": 1,
    "tags": ["petit-pays", "choix-oeuvre", "lecture-cursive"]
  },
  {
    "id": "eq-petit-pays-attente-examinateur",
    "oeuvre": "Petit pays",
    "auteur": "Gaël Faye",
    "question": "Diriez-vous que ce roman est une lecture facile ? Pourquoi l'avoir choisi malgré la gravité de son sujet ?",
    "category": "choix-oeuvre",
    "pistes": [
      "Reconnaître que le sujet est grave (guerre, génocide, exil) mais que l'écriture, portée par le regard d'un enfant et par un style sensoriel, rend la lecture accessible et prenante.",
      "Assumer un choix réfléchi : ce n'est pas la facilité qui a guidé, mais l'émotion et l'envie de comprendre une Histoire mal connue.",
      "Valoriser le fait qu'un roman puisse être à la fois lumineux (jeux, amitié, nature) et bouleversant (la chute dans la tragédie).",
      "Montrer que la difficulté du sujet est précisément ce qui rend la lecture marquante et formatrice."
    ],
    "reponseEssentielle": "Le **sujet** est grave — la guerre, le génocide, l'exil — mais la **lecture** ne l'est pas : tout passe par le regard d'un enfant et par un style très sensoriel, ce qui la rend accessible et prenante. Je ne l'ai pas choisi par facilité, mais parce qu'il m'a ému et m'a fait comprendre une Histoire que je connaissais mal. Un même livre peut être à la fois lumineux et bouleversant : c'est ce qui m'a marqué.",
    "difficulty": 2,
    "order": 2,
    "tags": ["petit-pays", "choix-oeuvre"]
  },
  {
    "id": "eq-petit-pays-bascule-recit",
    "oeuvre": "Petit pays",
    "auteur": "Gaël Faye",
    "question": "Comment le roman fait-il basculer une enfance heureuse dans la tragédie ?",
    "category": "comprehension",
    "pistes": [
      "La première moitié déploie une idylle : l'impasse tranquille, la bande d'amis, les bêtises (l'expédition pour les mangues), un anniversaire chaleureux.",
      "La bascule est progressive, par contamination lente : la séparation des parents ouvre la première blessure intime, puis la violence ethnique se rapproche.",
      "La grande Histoire — guerre au Burundi, génocide des Tutsi au Rwanda en 1994 — finit par frapper la famille maternelle et rend l'enfance impossible.",
      "Le dénouement impose l'exil : Gaby doit grandir trop vite et perdre son innocence, ce que le cadre rétrospectif annonçait dès l'ouverture."
    ],
    "reponseEssentielle": "Le basculement est **progressif**. La première moitié montre une idylle : l'impasse tranquille, la bande d'amis, les jeux. Puis la **séparation des parents** ouvre une première blessure, et la violence ethnique se rapproche peu à peu. Enfin la grande Histoire — la guerre au Burundi et le **génocide des Tutsi au Rwanda en 1994** — frappe la famille de la mère et rend l'enfance impossible, jusqu'à l'exil.",
    "difficulty": 2,
    "order": 3,
    "tags": ["petit-pays", "comprehension", "structure"]
  },
  {
    "id": "eq-petit-pays-personnages-principaux",
    "oeuvre": "Petit pays",
    "auteur": "Gaël Faye",
    "question": "Pouvez-vous présenter les principaux personnages du roman et leur rôle ?",
    "category": "comprehension",
    "pistes": [
      "Gaby, le narrateur, garçon métis d'une dizaine d'années, sensible et observateur, dont l'enfance bascule ; le narrateur adulte qu'il devient encadre tout le récit.",
      "Sa famille : Michel, le père français ; Yvonne, la mère rwandaise tutsi, que le drame du Rwanda atteint dans ses proches ; Ana, la petite sœur.",
      "La bande de l'impasse (Gino, Armand, les jumeaux), qui incarne l'insouciance de l'enfance, puis se divise avec la montée des tensions.",
      "Madame Economopoulos, la voisine qui prête des livres à Gaby et éveille en lui le goût de la lecture."
    ],
    "reponseEssentielle": "Le narrateur est **Gaby**, un garçon métis d'une dizaine d'années. Son père **Michel** est français, sa mère **Yvonne** est rwandaise tutsi, et il a une petite sœur, **Ana**. Il a une bande d'amis dans l'impasse, qui incarne l'insouciance puis se divise avec la montée des tensions. Enfin, la voisine **Madame Economopoulos** lui prête des livres et lui donne le goût de lire. Le récit est raconté par Gaby devenu adulte.",
    "difficulty": 1,
    "order": 4,
    "tags": ["petit-pays", "comprehension", "personnages"]
  },
  {
    "id": "eq-petit-pays-sens-titre",
    "oeuvre": "Petit pays",
    "auteur": "Gaël Faye",
    "question": "Comment comprenez-vous le titre, Petit pays ?",
    "category": "comprehension",
    "pistes": [
      "Le titre désigne d'abord le Burundi, petit pays d'Afrique des Grands Lacs où se déroule l'enfance de Gaby.",
      "Il a aussi un sens intérieur : le « petit pays » est le territoire de l'enfance, ce monde clos et heureux de l'impasse, perdu à jamais.",
      "Le titre reprend celui d'une chanson de Gaël Faye, qui disait déjà la nostalgie de la terre d'enfance et la blessure de l'exil.",
      "L'adjectif « petit » dit la tendresse et la fragilité : un monde minuscule et précieux que la grande Histoire vient écraser."
    ],
    "reponseEssentielle": "Le titre désigne d'abord le **Burundi**, le petit pays où Gaby passe son enfance. Mais il a aussi un sens intérieur : le « petit pays », c'est le **territoire de l'enfance**, ce monde clos et heureux de l'impasse, perdu pour toujours. Faye reprenait là le titre d'une de ses chansons sur la nostalgie de la terre natale. L'adjectif « petit » dit la tendresse et la fragilité d'un monde que la grande Histoire vient écraser.",
    "difficulty": 2,
    "order": 5,
    "tags": ["petit-pays", "comprehension", "titre"]
  },
  {
    "id": "eq-petit-pays-regard-enfant",
    "oeuvre": "Petit pays",
    "auteur": "Gaël Faye",
    "question": "Quel est l'effet du choix de raconter la guerre à hauteur d'enfant ?",
    "category": "interpretation",
    "pistes": [
      "Gaby ne saisit la politique et la haine ethnique que par fragments, rumeurs et sensations : la violence est perçue de biais, ce qui la rend plus saisissante.",
      "Le décalage entre ce que l'enfant ne comprend pas et ce que le lecteur devine produit un effet d'ironie tragique et accroît l'indignation.",
      "Ce point de vue interdit le discours explicatif : c'est l'incompréhension de l'enfant qui dénonce, plus efficacement qu'un commentaire, l'absurdité de la haine.",
      "Le double regard est essentiel : le narrateur adulte, installé en France, encadre et colore de nostalgie les souvenirs de l'enfant qu'il était."
    ],
    "reponseEssentielle": "Gaby ne comprend la politique et la haine que par **bribes**, par rumeurs et par sensations : la violence est vue de biais, ce qui la rend plus forte. Il y a un décalage entre ce que l'enfant ne comprend pas et ce que nous, lecteurs, devinons : c'est cette **incompréhension** qui dénonce l'absurdité de la haine, mieux qu'un long discours. En plus, le narrateur adulte en France colore tout d'une grande nostalgie.",
    "difficulty": 3,
    "order": 6,
    "tags": ["petit-pays", "interpretation", "point-de-vue"]
  },
  {
    "id": "eq-petit-pays-identite-metissage",
    "oeuvre": "Petit pays",
    "auteur": "Gaël Faye",
    "question": "En quoi la question de l'identité et du métissage est-elle centrale dans le roman ?",
    "category": "interpretation",
    "pistes": [
      "Gaby est métis, fils d'un père français (Michel) et d'une mère rwandaise tutsi (Yvonne) : il vit dans un entre-deux, partagé entre plusieurs appartenances.",
      "Le roman interroge ce que signifie « être de quelque part » quand la société somme chacun de choisir un camp ethnique.",
      "Gaby tente de rester en dehors de ces assignations, et ce refus apparaît comme un geste courageux face à la pression de la haine.",
      "Le métissage donne au narrateur un regard décentré sur les deux mondes, sans qu'il appartienne pleinement à aucun, ce qui nourrit le sentiment d'exil intérieur."
    ],
    "reponseEssentielle": "Gaby est **métis**, fils d'un père français (Michel) et d'une mère rwandaise tutsi (Yvonne) : il vit dans un **entre-deux**, entre plusieurs appartenances. Le roman demande ce que veut dire « être de quelque part » quand la société oblige chacun à choisir un camp ethnique. Gaby refuse cette assignation, et ce refus paraît courageux face à la haine qui monte.",
    "difficulty": 2,
    "order": 7,
    "tags": ["petit-pays", "interpretation", "identite", "metissage"]
  },
  {
    "id": "eq-petit-pays-lecture-refuge",
    "oeuvre": "Petit pays",
    "auteur": "Gaël Faye",
    "question": "Quel rôle joue la lecture dans la vie de Gaby, et qu'apporte ce thème au roman ?",
    "category": "interpretation",
    "pistes": [